{
  "settingId": "spuk_im_schlosskeller",
  "massstab": "1 Kachel = 1 Meter; x nach Osten, y nach Süden; Rechtecke als Bodenkacheln (x, y, b, l)",
  "raster": {
    "breite": 27,
    "hoehe": 23
  },
  "rooms": [
    {
      "id": "thekensaal",
      "name": "Thekensaal (Zentrum)",
      "anzeigename": "Buffetsaal",
      "widthMeters": 8,
      "rechteck": {
        "x": 11,
        "y": 7,
        "b": 8,
        "l": 12
      },
      "boden": "stone",
      "features": [
        "Buffettheke mit Anrichte",
        "Linker Buffettisch",
        "Rechter Buffettisch",
        "Großer Teekocher",
        "Kaffeemaschine",
        "Spüle",
        "Eiskübel",
        "Notausgangsschild"
      ],
      "beschreibung": "Länglicher Gewölbesaal, Knotenpunkt des Kellers. Gegenüber dem Eingang steht die Buffettheke aus dunklem Holz, dahinter die Anrichte an der Nordwand. Links und rechts an den Längswänden die Buffettische."
    },
    {
      "id": "vorratsraum",
      "name": "Vorratsraum",
      "anzeigename": "Vorratsraum",
      "rechteck": {
        "x": 13,
        "y": 2,
        "b": 3,
        "l": 4
      },
      "boden": "stone",
      "features": [
        "Regale",
        "Geburtstagstorte",
        "Notlaterne am Haken"
      ],
      "beschreibung": "Kleiner, kühler Raum ohne Fenster hinter der Buffettheke. Einziger Zugang ist die Tür neben der Anrichte."
    },
    {
      "id": "durchgang",
      "name": "Durchgang",
      "anzeigename": "Durchgang",
      "rechteck": {
        "x": 8,
        "y": 8,
        "b": 2,
        "l": 2
      },
      "boden": "stone",
      "features": [
        "Getränkekisten"
      ],
      "beschreibung": "Kurzer, niedriger Gang zwischen West-Saal und Buffetsaal. Hier stehen die Getränkekisten."
    },
    {
      "id": "west_saal",
      "name": "West-Saal",
      "anzeigename": "Kaminsaal",
      "rechteck": {
        "x": 1,
        "y": 8,
        "b": 6,
        "l": 12
      },
      "boden": "stone",
      "features": [
        "Lange Tafeln",
        "Wandbänke",
        "Kamin-Nische",
        "Sicherungskasten",
        "Lichtschächte mit Klappen",
        "Bogentür zum Turmgang"
      ],
      "beschreibung": "Gemeinschaftssaal mit zwei langen Tafeln und Wandbänken. In der Westwand die Kamin-Nische, hoch in der Nordwand zwei Lichtschächte mit Klappen, in der Nordwestecke die geschnitzte Bogentür zum Turm."
    },
    {
      "id": "turmgang",
      "name": "Turmgang",
      "anzeigename": "Turmgang",
      "rechteck": {
        "x": 1,
        "y": 1,
        "b": 3,
        "l": 6
      },
      "boden": "stone",
      "features": [
        "Ritterrüstung",
        "Schauvitrine",
        "Wendeltreppe zum WC",
        "Hoftür (verschlossen)"
      ],
      "beschreibung": "Schmaler Gang im Fuß des Schlossturms. Hier stehen die alte Ritterrüstung und die Schauvitrine. Die Wendeltreppe führt hinauf zu den Toiletten; der Rest des Turms ist mit einem Vorhängeschloss abgesperrt."
    },
    {
      "id": "ost_saal",
      "name": "Ost-Saal",
      "anzeigename": "Ostsaal",
      "rechteck": {
        "x": 20,
        "y": 7,
        "b": 6,
        "l": 12
      },
      "boden": "stone",
      "features": [
        "Lange Tafeln",
        "Wandbänke",
        "Jackenständer",
        "Wandtafel mit Ablaufplan",
        "Handykorb"
      ],
      "beschreibung": "Ruhiger Gemeinschaftssaal ohne weitere Außentür. Am Eingang steht der Jackenständer, an der Ostwand die Wandtafel mit dem Ablaufplan des Abends."
    },
    {
      "id": "windfang",
      "name": "Windfang",
      "anzeigename": "Windfang",
      "rechteck": {
        "x": 14,
        "y": 20,
        "b": 2,
        "l": 2
      },
      "boden": "stone",
      "features": [
        "Innentür",
        "Außentor"
      ],
      "beschreibung": "Kleiner Vorraum zwischen der Innentür des Buffetsaals und dem Außentor."
    }
  ],
  "tueren": [
    {
      "id": "aussentor",
      "name": "Außentor",
      "von": "windfang",
      "nach": "draussen",
      "kacheln": [
        [
          14,
          22
        ],
        [
          15,
          22
        ]
      ],
      "art": "zweiflügelige, eisenbeschlagene Eichentür mit Kastenschloss",
      "schliesst": "schluessel_beidseitig",
      "schluessel": "bund_schneider",
      "zustand": "verschlossen ab 18:50",
      "quietscht": true
    },
    {
      "id": "windfang_tuer",
      "name": "Innentür",
      "von": "thekensaal",
      "nach": "windfang",
      "kacheln": [
        [
          14,
          19
        ]
      ],
      "art": "schwere Holztür",
      "schliesst": "keine",
      "zustand": "zu (Zugluft)",
      "quietscht": true
    },
    {
      "id": "vorrat_tuer",
      "name": "Vorratsraumtür",
      "von": "thekensaal",
      "nach": "vorratsraum",
      "kacheln": [
        [
          14,
          6
        ]
      ],
      "art": "einfache Holztür",
      "schliesst": "keine",
      "zustand": "angelehnt",
      "quietscht": false
    },
    {
      "id": "durchgang_ost",
      "name": "Tür zum Durchgang",
      "von": "thekensaal",
      "nach": "durchgang",
      "kacheln": [
        [
          10,
          9
        ]
      ],
      "art": "Holztür neben der Theke (links)",
      "schliesst": "keine",
      "zustand": "offen",
      "quietscht": true
    },
    {
      "id": "durchgang_west",
      "name": "Bogen zum Kaminsaal",
      "von": "durchgang",
      "nach": "west_saal",
      "kacheln": [
        [
          7,
          9
        ]
      ],
      "art": "offener Steinbogen",
      "schliesst": "keine",
      "zustand": "offen",
      "quietscht": false
    },
    {
      "id": "ost_tuer",
      "name": "Tür zum Ostsaal",
      "von": "thekensaal",
      "nach": "ost_saal",
      "kacheln": [
        [
          19,
          9
        ]
      ],
      "art": "Holztür neben der Theke (rechts)",
      "schliesst": "keine",
      "zustand": "offen",
      "quietscht": true
    },
    {
      "id": "bogentuer",
      "name": "Bogentür zum Turm",
      "von": "west_saal",
      "nach": "turmgang",
      "kacheln": [
        [
          2,
          7
        ]
      ],
      "art": "jahrhundertealte, geschnitzte Bogentür aus Eiche, ein Beschlag herausgerissen",
      "schliesst": "keine",
      "zustand": "offen",
      "quietscht": true
    },
    {
      "id": "hoftuer",
      "name": "Hoftür",
      "von": "turmgang",
      "nach": "draussen",
      "kacheln": [
        [
          2,
          0
        ]
      ],
      "art": "schwere Turmtür zum Schlosshof",
      "schliesst": "schluessel_beidseitig",
      "schluessel": "bund_schneider",
      "zustand": "verschlossen ab 18:50",
      "quietscht": true
    }
  ],
  "einrichtung": [
    {
      "id": "spuele",
      "name": "Spüle",
      "typ": "counter",
      "x": 12,
      "y": 7,
      "blockiert": true,
      "darstellung": "sink"
    },
    {
      "id": "anrichte",
      "name": "Anrichte mit Messingkerzenständer",
      "typ": "counter",
      "x": 13,
      "y": 7,
      "blockiert": true,
      "darstellung": "candles"
    },
    {
      "id": "teekocher",
      "name": "großer Teekocher",
      "typ": "counter",
      "x": 15,
      "y": 7,
      "blockiert": true,
      "darstellung": "stove"
    },
    {
      "id": "kaffeemaschine",
      "name": "Kaffeemaschine an der alten Mehrfachsteckdose",
      "typ": "counter",
      "x": 16,
      "y": 7,
      "blockiert": true,
      "darstellung": "stove"
    },
    {
      "id": "anrichte_ost",
      "name": "Anrichte mit Gläsern und Tassen",
      "typ": "counter",
      "x": 17,
      "y": 7,
      "blockiert": true,
      "darstellung": "counter"
    },
    {
      "id": "theke_12",
      "name": "Buffettheke",
      "typ": "counter",
      "x": 12,
      "y": 9,
      "blockiert": true
    },
    {
      "id": "theke_13",
      "name": "Buffettheke",
      "typ": "counter",
      "x": 13,
      "y": 9,
      "blockiert": true
    },
    {
      "id": "theke_14",
      "name": "Buffettheke",
      "typ": "counter",
      "x": 14,
      "y": 9,
      "blockiert": true
    },
    {
      "id": "theke_15",
      "name": "Buffettheke",
      "typ": "counter",
      "x": 15,
      "y": 9,
      "blockiert": true
    },
    {
      "id": "theke_16",
      "name": "Buffettheke",
      "typ": "counter",
      "x": 16,
      "y": 9,
      "blockiert": true
    },
    {
      "id": "theke_17",
      "name": "Buffettheke",
      "typ": "counter",
      "x": 17,
      "y": 9,
      "blockiert": true
    },
    {
      "id": "linkes_buffet_12",
      "name": "linker Buffettisch",
      "typ": "table",
      "x": 12,
      "y": 12,
      "blockiert": true
    },
    {
      "id": "linkes_buffet_13",
      "name": "linker Buffettisch",
      "typ": "table",
      "x": 12,
      "y": 13,
      "blockiert": true
    },
    {
      "id": "linkes_buffet_14",
      "name": "linker Buffettisch",
      "typ": "table",
      "x": 12,
      "y": 14,
      "blockiert": true
    },
    {
      "id": "linkes_buffet_15",
      "name": "linker Buffettisch",
      "typ": "table",
      "x": 12,
      "y": 15,
      "blockiert": true
    },
    {
      "id": "rechtes_buffet_12",
      "name": "rechter Buffettisch",
      "typ": "table",
      "x": 17,
      "y": 12,
      "blockiert": true
    },
    {
      "id": "rechtes_buffet_13",
      "name": "rechter Buffettisch",
      "typ": "table",
      "x": 17,
      "y": 13,
      "blockiert": true
    },
    {
      "id": "rechtes_buffet_14",
      "name": "rechter Buffettisch",
      "typ": "table",
      "x": 17,
      "y": 14,
      "blockiert": true
    },
    {
      "id": "rechtes_buffet_15",
      "name": "rechter Buffettisch",
      "typ": "table",
      "x": 17,
      "y": 15,
      "blockiert": true
    },
    {
      "id": "regal_torte",
      "name": "Regal mit der Geburtstagstorte",
      "typ": "bookshelf",
      "x": 13,
      "y": 2,